81192,198801,0601-1200,ORD,IL,,15,,5000,,Marginal,,,Daylight,,,TRACON ORD,Air Carrier,Medium Large Transport; Low Wing; 2 Turbojet Eng,,2,,IFR,Passenger,,Cruise; Initial Approach,Vectors,Class B ORD,,,,,,,,,,,,,,,,,,,,,,,,,,,,,,,,,,,,,,,,,,,,,,,,,,,,,,,,,,,,,,,,,Air Carrier,Captain; Pilot Flying,Flight Crew Air Transport Pilot (ATP),Flight Crew Last 90 Days 240; Flight Crew Total 11000; Flight Crew Type 5000,,,,,81192,,,,First Officer,Flight Crew Air Transport Pilot (ATP),,,,,,,Other Unspecified,,,Person Flight Crew,,Air Traffic Control Issued New Clearance,,Human Factors,"FLT CVG TO ORD; WAS HANDED OFF FROM CHICAGO CENTER TO CHICAGO APCH CTL. THE APCH CTLR WAS TOO BUSY TO ACKNOWLEDGE OUR FIRST 2 CALL-INS; BUT ON THE THIRD; SOME 3+ MINS LATER; ACKNOWLEDGED THAT HE WAS VERY BUSY. APPARENTLY HE WAS WORKING MORE THAN 1 FREQ AS WE COULD ONLY HEAR HIS SIDE OF THE TRANSMISSIONS. RWY 27R WAS THE ONLY RWY IN USE AS 27L WAS CLOSED FOR SNOW REMOVAL. THIS FIRST APCH CTLR ASSIGNED US RWY 27R WITH THE FREQ OF 110.5. LATER WE WERE HANDED OFF TO THE FINAL CTLR WHO TURNED US TO WHAT APPEARED AN INTERCEPT HDG. THE F/O NOTICED THAT ACFT COMING ON FREQ WERE ALL BEING ASSIGNED 27L AND OUR ASSIGNED ALT WAS 5000'. WE QUESTIONED THE CTLR TWICE AS TO OUR ASSIGNED RWY BEFORE HE ASKED WHO WAS CALLING ABOUT 27R. THE SUSPICION WAS CONFIRMED WHEN APCH TURNED US AWAY FROM 27R AND BACK TO 27L FROM N OF THE 27L LOC. HE ALSO NOTIFIED US THAT TFC INBND FOR 27R WAS AT A DIFFERENT ALT. I FEEL THE CTLRS WERE OVERLOADED WITH THE CLOSING AND OPENING OF RWY 27L AND DID NOT HAVE TIME TO LISTEN TO THE READBACK OF CLRNCS. IN ADDITION; THE TRANSITION OF CTL CONTRIBUTED TO THE FINAL CTLR GETTING INCOMPLETE INFO PERTINENT TO OUR FLT. THANKS TO THE VIGILANCE OF THE F/O; I FEEL A SERIOUS ENCROACHMENT OF 27R WAS AVERTED.",,,,"ACR MLG REPORTS CLRNC TO WRONG RWY AT ORD.",
81194,198801,1201-1800,ALB,NY,,28,,2800,,VMC,,,Night,,,TRACON ALB,Air Carrier,Medium Large Transport; Low Wing; 2 Turbojet Eng,,2,,IFR,Passenger,,Descent; Descent; Cruise,Vectors,Class E ALB,,,,,,,,,,,,,,,,,,,,,,,,,,,,,,,,,,,,,,,,,,,,,,,,,,,,,,,,,,,,,,,,,Air Carrier,Captain,Flight Crew Instrument; Flight Crew Flight Engineer; Flight Crew Commercial; Flight Crew Air Transport Pilot (ATP),Flight Crew Last 90 Days 200; Flight Crew Total 9000; Flight Crew Type 75,,,,,81194,,,,First Officer; Pilot Flying,Flight Crew Instrument; Flight Crew Commercial,,,,,,,Deviation / Discrepancy - Procedural Published Material / Policy; Deviation / Discrepancy - Procedural FAR; Inflight Event / Encounter CFTT / CFIT,,,Automation Air Traffic Control; Person Flight Crew,,Air Traffic Control Issued New Clearance,,Human Factors,"FLT FROM PIT-ALB. WE WERE BEING VECTORED FROM THE S FOR AN APCH TO RWY 19 ALB. THE ALB VOR WAS OTS BUT FMC DATA WAS ONBOARD. APCH CLRD US TO DES FROM 4000-2000'; ON APPROX PATH DRAWN AT RIGHT. F/O WAS FLYING AND AT 2800' MSL THE REFLECTIONS OF SNOW COULD BE SEEN ON THE GND. THERE WERE NO LIGHTS ON THE GND FOR VISUAL REF. WE XCHKED RADIO ALTIMETER WHICH INDICATED 1000' AGL. AT 2800' WE HAD 800' TO GO TO CLRD ALT OF 2000'. THIS WOULD HAVE PUT US ON THE GND OR VERY CLOSE. RADIO ALTIMETER WAS CHANGING SLIGHTLY DUE TO TERRAIN. ACFT WAS 170 KTS WITH 5 DEG FLAPS EXTENDED. WE NEVER GOT ANY GPWS WARNING WHICH WAS OPERATING. WE STARTED TO DRIFT BACK UP WHILE ASSESSING OUR POS AND AT THIS TIME RECEIVED A CLRNC FROM SEPARATE CTLR TO CLB TO 4000' AND TURN RIGHT TO 100 DEGS. WE HAD ALREADY DRIFTED BACK UP TO 3300' AT THIS TIME. WE CHKED FMC (FLT MGMNT COMPUTER) FOR DISTANCE AT THIS TIME AND WERE 25 MI FROM ALB ARPT. THOUGHTS: IF WX HAD BEEN IMC WE MIGHT HAVE HIT THE GND. OUR ATTN WAS GAINED BY VISUAL REF TO GND. ALL LNDG LIGHTS WERE ON; WHICH MAY HAVE CAUSED REFLECTION FROM SNOW-COVERED GND BELOW. TOTAL FLT TIME FOR DAY WAS 8-9 ACTUAL TIME. BOTH CREW STARTED DAY EARLY AM FOR HOME BASE TRIP. FLAPS 5 DEGS (GEAR UP). WE WERE DSNDING SLOWLY (300-500 FPM). NO GPWS WARNING. RADIOS TUNED TO ILS RWY 19 (VOR OTS FOR DISTANCE). WE DISCUSSED WITH APCH SUPVR ON GND. HE PULLED TAPES AND FILED A RPT TO DCA ON CTLRS. THERE WAS A TRNEE AND INSTR CTLR. HE ADMITTED THEY WERE AT FAULT AND ASSURED NO FURTHER PROB ON OUR END. HE SAID THE ALARM ON THEIR SCREEN BROUGHT THE SITUATION TO THEIR ATTN. THEIR CORRECTIVE INSTRUCTIONS TO US WOULD NOT HAVE STOPPED US IN TIME FROM REACHING 2000'. 8 ACFT WERE ON APCH AND CTLR SEEMED VERY BUSY. PERCEPTION: AFTER XCHKING ALTIMETER 2800' AND RADIO ALTIMETER 1000' AGL; RESPONSE WAS 'SOMETHING IS NOT RIGHT.' IT TOOK A MOMENT TO ASSESS THE INFO AVAILABLE AND BEGIN CORRECTION. VISUAL REF TO GND WAS OUR STRONGEST REINFORCEMENT. THERE WAS A MOMENT OF DISBELIEF IN OUR POS. CBC CONVERSATION WITH RPTR REVEALED THE FOLLOWING: COMPANY POLICY DOES NOT DICTATE INCLUDING MSA WHEN DOING AN APCH BRIEFING AND THIS WAS NOT DONE ON THE NIGHT OF THIS INCIDENT. APCH CTLR SUPVR THOUGHT AN INTERCEPT TURN HAD BEEN GIVEN BUT A REVIEW OF THE TAPES PROVED A TURN WAS NOT GIVEN AND THE FAC ADMITTED THEY MADE AN ERROR. THE REQUIRED OPERROR RPTS WERE SENT TO DC BY THE APCH CTLR SUPVR.",,,,"ACR MLG ACCEPTED A CLRNC AND STARTED DESCENT TO AN ALT BELOW MSA. SNOW REFLECTION AND RADIO ALTIMETER ALERTED THE FLT CREW TO THE ERROR.",
81196,198801,1801-2400,LGA,NY,,,0,,,IMC,.5,,Night,700,,Tower LGA,Air Carrier,Medium Large Transport; Low Wing; 2 Turbojet Eng,,2,,IFR,Passenger,,Initial Climb; Takeoff / Launch,,Class B N90,,,,,,,,,,,,,,,,,,,,,,,,,,,,,,,,,,,,,,,,,,,,,,,,,,,,,,,,,,,,,,,,,Air Carrier,Pilot Flying; Captain,Flight Crew Air Transport Pilot (ATP),Flight Crew Last 90 Days 350; Flight Crew Total 16000; Flight Crew Type 8500,,,,,81196,,,,First Officer,Flight Crew Air Transport Pilot (ATP),,,,,,,Aircraft Equipment Problem Critical; Inflight Event / Encounter Weather / Turbulence; Inflight Event / Encounter Other / Unknown,,,Person Flight Crew,,Aircraft Equipment Problem Dissipated,,Weather,"FLT OPERATED LGA TO MSP AS AN MLG ON THE NIGHT OF 1/MON/88 WITH A DEADHEADING CREW ON BOARD. THE WX WAS IMC WITH MODERATE TO HEAVY SNOW; THE TEMP WAS 33 DEGS F. I REQUESTED FOR THE ACFT TO BE DEICED. THE F/O AND MYSELF MADE WALKAROUNDS; EVERYTHING WAS NORMAL EXCEPT THAT SNOW HAD LODGED AROUND THE BRAKE ASSEMBLY OF THE MAIN GEAR AND NOSE WHEEL AREAS. I ADVISED THE LGA OPS THAT I WOULD LIKE THE DEICING CREW TO DEICE THOSE AREAS ALONG WITH THE WHOLE ACFT. WE TAXIED OUT AND SPENT 20 MINS IN GETTING TO THE RWY (13/31). WE WERE #2 FOR DEP; ACR Y; AN MLG; WAS #1. I OBSERVED A LARGE ACCUMULATION OF SNOW ON THE TAIL OF THAT ACFT. AT ABOUT THE SAME TIME THE F/O OF THE DEADHEADING CREW CAME FORWARD; WITH MY PERMISSION; TO ADVISE ME OF THE SNOW ACCUMULATION ON OUR WINGS. I LOOKED FOR MYSELF AND INSTRUCTED THE F/O TO REQUEST A RETURN TO THE GATE FOR FURTHER DEICING. BACK IN THE GATE I AGAIN ASKED OPS TO HAVE THE DEICING CREW CHK THE WHEEL ASSEMBLIES FOR SNOW PACKING AND TO DEICE. WE DEPARTED THE GATE AGAIN AND PROCEEDED TO RWY 13. AS I ACCELERATED DOWN THE RWY I NOTICED 2 HESITATIONS OF ACCELERATION. I THOUGHT THAT IT WAS THE SNOW DISLODGING FROM THE WHEEL AREAS AND THE WHEELS RUNNING OVER SAME. AFTER WE BECAME AIRBORNE THE TWR CTLR ASKED; '(ID); ARE YOU OK?' WE RPTED; 'YES; WE ARE FINE.' THE OPERATION WAS NORMAL AND A LNDG WAS MADE AT MSP. ABOUT 1 1/2 HRS INTO THE FLT THE CAPT OF THE DEADHEADING CREW ASKED PERMISSION TO SPEAK TO ME. I GRANTED HER ENTRANCE INTO THE COCKPIT. SHE INFORMED ME THAT AS I TOOK THE RWY FOR DEP AND PUT ON THE LNDG LIGHTS SHE COULD SEE SNOW COMING OFF THE TRAILING EDGE OF THE WING AND SNOW SLIDING BY THE WINDOWS. SHE ALSO INFORMED ME AT THAT TIME THAT THERE WERE 2 LOUD BANGING SOUNDS NEAR THE ENG AREAS. AT THAT TIME ONE OF THE DEADHEADING F/A'S IN THE CABIN YELLED OUT; 'PREPARE FOR IMPACT.' LATER MY #1 F/A EXPRESSED TO ME SHE THOUGHT WE WERE GOING IN. WE LANDED AT MSP AND I HAD MAINT LOOK OVER THE ENGS AND ALSO NOTIFIED FLT CTL. I CALLED LGA TWR LONG DISTANCE AND TALKED TO THE TWR SUPVR. HE SAID HE OBSERVED 2 BRIGHT FLAMES COMING FROM THE REAR OF OUR 2 ENGS. HE IMMEDIATELY CLOSED RWY 13 AND CALLED DEP CTL TO SEE IF WE WERE AIRBORNE AND IN RADAR CONTACT. HE SAID HE WAS READY TO ALERT EMER PERSONNEL AND EQUIP IF HE DID NOT GET A POSITIVE RPT FROM DEP CTL. PS: I WOULD LIKE TO SEE A FOLLOW-UP ON MY RPT; PLEASE. CALLBACK CONVERSATION WITH RPTR REVEALED THE FOLLOWING: THE RWY HAD BEEN PLOWED EARLIER BUT IT WAS STILL SNOWING. AT THE TIME OF TKOF THERE WAS A BRIEF LET UP IN THE SNOW FALL AND RWYS 4/22 WERE CLOSED FOR SNOWPLOW OPERATION. THE TKOF RUN WAS CONSIDERABLY LONGER THAN NORMAL AND THE DEADHEAD CAPT RPTED HEARING 8-9 COMPRESSOR STALLS. RPTR RESTATED THAT HE NOTED SOME HESITATION DURING TKOF ROLL; BUT THOUGHT IT BECAUSE OF THE SNOW PACK BTWN THE TIRES BEING THROWN AHEAD OF THE ACFT AND CREATING AN OBSTACLE. NOTE ON RPT REQUESTING A FOLLOW-UP WAS ADDRESSED TO THE COMPANY AND NOT ASRS.",,,,"ACR MLG EXPERIENCED SEVERAL COMPRESSOR STALLS DURING TKOF RUN FROM LGA.",
81203,198801,1201-1800,BMG,IN,,20,,0,,Mixed,2,,Daylight,1900,,TRACON HUF,Air Taxi,Small Transport; Low Wing; 2 Recip Eng,,1,,IFR,Passenger,,Cruise; Cruise,Direct,Class E HUF,,,,,,,,,,,,,,,,,,,,,,,,,,,,,,,,,,,,,,,,,,,,,,,,,,,,,,,,,,,,,,,,,Air Taxi,Pilot Flying; Single Pilot,Flight Crew Commercial; Flight Crew Instrument,Flight Crew Last 90 Days 148; Flight Crew Total 1752; Flight Crew Type 95,,,,,81203,,,,,,,,,,,,Aircraft Equipment Problem Critical; Deviation / Discrepancy - Procedural Clearance; Deviation / Discrepancy - Procedural FAR,,,Automation Aircraft Other Automation,,Aircraft Aircraft Damaged; General Declared Emergency; General None Reported / Taken,,Aircraft,"DEPARTED SEYMOUR; IN; IN 1/88 WITH 3 PAX ENRTE TO SPRINGFIELD; IL. CLBING THROUGH THE CLOUDS I CROSSED BMG WITH NO APPARENT PROB. INDY HANDED ME OFF TO HOLMAN (TERRE HAUTE) APCH. ALT CLRNC LIMIT 8000'. APPROX 20 MI NW OF BMG THE LOW VOLTAGE LIGHT BEGAN TO FLICKER. I REDUCED THE ELECTRIC LOAD; LEAVING ONLY THE PITOT HEAT AND AVIONICS ON AND CHKED THE LOAD METER. THE LOAD METER APPEARED INOP; SHOWING A ZERO READING ON EVERY SETTING. DOING THE PROC TWICE I WAS CONTINUING TO LOSE ELECTRIC ITEMS. FIRST; THE LEFT ENG ELECTRIC GAUGES QUIT (FUEL QUANTITY AND OIL TEMP). WITHIN A FEW MINS THE RIGHT ENG ELECTRIC GAUGES QUIT. AT THAT TIME; THE APCH CTLR WAS GIVING THE WX AT TERRE HAUTE TO ANOTHER PLANE. CEILING 1700'. AT THIS TIME I WAS ABOVE A CLOUD LAYER IN VFR CONDITIONS. I HAD BEEN SUSPICIOUS OF MY NAV EQUIP'S RELIABILITY SINCE SHORTLY AFTER I CROSSED BMG. IT JUST DIDN'T SEEM RIGHT. REFERRING TO MY MAP; I FLEW A HDG; MADE A DECISION TO DES AND LAND. I WAS WAITING FOR THE FREQ TO CLR TO CALL THE CTLR WHEN THE RADIOS FELL OFF THE LINE (QUIT MID SENTENCE). I USED MY TRANSPONDER TO SQUAWK THE SEQUENCE CODES AND ATTEMPTED TO CALL ON THE RADIO. REALIZING THIS WAS ALL USELESS; I LOOKED AROUND THE SKY; THEN MADE A WIDE RIGHT TURN TO ATTEMPT TO FIND A HOLE IN THE LAYER BELOW. WHEN THERE WAS NO HOLE; I TURNED TO THE SAME HDG I HAD BEEN ON AND BEGAN MY DES. DURING MY DES I CONTINUED TO ATTEMPT TO GET THE ELECTRIC TO RESPOND. I CHOSE TO STAY ON THAT HDG BECAUSE THE RPTED WX I RECEIVED BEFORE THE FLT CALLED FOR BETTER WX TO THE W OF MY POS. I WAS ABLE TO REMAIN VFR UNTIL I REACHED 3000'. I WENT THROUGH A CLOUD LAYER AND BROKE OUT AT 2000' AND SLOWED MY SPD. I REMAINED BELOW THE CLOUD LAYER AND ON THE SAME HDG UNTIL I REACHED A MAJOR HWY. I TURNED TO THE W AND FOLLOWED THE HWY TOWARD A CITY I BELIEVED LARGE ENOUGH TO HAVE AN ARPT. SHORTLY AFTER; I SPOTTED A SMALL STRIP. I LOCATED SOME SMOKE TWRS TO FIND THE WIND DIRECTION. I MADE A PASS OVER THE ARPT; THEN HEADED N AND SLOWED MY SPD FOR THE APCH. I ATTEMPTED TO GET THE ELECTRIC BACK 1 MORE TIME. WITH NO ELECTRIC PWR; I MANUALLY EXTENDED THE GEAR; TURNING THE CRANK UNTIL IT STOPPED. ON FINAL; JUST AS A FINAL ATTEMPT; I PUT THE FLAP HANDLE DOWN; TURNED THE BOOST PUMPS ON; PROP LEVERS FORWARD; AND ADVISED MY PAX TO BRACK THEMSELVES AND BE SURE THEIR RESTRAINTS WERE TIGHT. I ALSO ADVISED THEM THAT THE GEAR WAS DOWN; BUT I HAD NO INDICATION TO KNOW IF IT WAS LOCKED. I WAS ON SHORT FINAL FULLY PREPARED TO DO A GO AROUND IF NECESSARY. THE STRIP HAD HIGH LINES AT THE LNDG END OF THE RWY; SO I KEPT PWR ON THE PLANE UNTIL I WAS DIRECTLY OVER THE OBSTACLE; THEN TAKING ALL OF THE PWR OFF THE PLANE; I DOVE FOR THE END OF THE RWY AND GND EFFECT WHERE I LEVELED OFF AND BEGAN FEELING FOR THE GND. I FELT THE PLANE ROLLING ON THE LEFT MAIN; TURNED AND TOLD MY PAX WE DO HAVE A LNDG GEAR; FELT FOR THE RIGHT WHEEL AND REALIZED IT WAS NOT GOING TO HOLD. I FEATHERED THE RIGHT ENG AND TOLD MY PAX TO BRACE THEMSELVES AS THE GEAR WAS NOT LOCKED; HOLDING THE RIGHT WING OFF THE GND AS MUCH AS POSSIBLE UNTIL THE LEFT MAIN COLLAPSED AND WE SKIDDED TO THE RIGHT AND OFF THE RWY. I GOT MY PAX OUT OF THE PLANE; CLOSED THE GANG BARS; AND THERE WERE VEH'S THERE TO TAKE US TO THE TERMINAL.",,,,"GA SMT ATX LOST ELECTRICAL POWER AND ALL RADIOS. PLT ELECTED TO CONTINUE TOWARD DESTINATION THE THEN TO DESCEND THROUGH CLOUD COVER AND SEARCH FOR AN ARPT.",
81206,198801,1201-1800,DFW,TX,,15,,10500,,VMC,,,Daylight,,,TRACON DFW,Air Carrier,Large Transport; Low Wing; 3 Turbojet Eng,,3,,IFR,Passenger,,Descent; Descent,STAR STAR,Class E DFW,,,,,,,,,,,,,,,,,,,,,,,,,,,,,,,,,,,,,,,,,,,,,,,,,,,,,,,,,,,,,,,,,Air Carrier,Pilot Flying; Captain,Flight Crew Air Transport Pilot (ATP); Flight Crew Flight Engineer,Flight Crew Last 90 Days 200; Flight Crew Total 18000,,,,,81206,,,Air Carrier,Flight Engineer / Second Officer,Flight Crew Air Transport Pilot (ATP); Flight Crew Flight Engineer,Flight Crew Last 90 Days 220; Flight Crew Total 2000,,,,,81159,Deviation - Altitude Overshoot; Other Unspecified,,,Person Air Traffic Control,,Air Traffic Control Issued New Clearance,,Human Factors,"SHORTLY AFTER BEING CLRD TO CROSS PIVIT AT 11000' AND 250 KTS; AND BEING SLOWED TO 280 KTS FOR DES; WE WERE CHANGED TO ANOTHER APCH CTL FREQ. UPON INITIAL CONTACT; APCH SAID TO DELETE THE SPD AT PIVIT. I INQUIRED AS TO WHAT SPD THEY WOULD LIKE FOR XYZ. APCH RESPONDED; 'XYZ; SLOW TO 230 K AND DES TO 5000'.' I ACKNOWLEDGED. LATER WHEN DSNDING THROUGH APPROX 10500'; APCH ASKED MY ALT AND SAID; 'YOU WERE ONLY CLRD TO 11000'.' A SHORT DISCUSSION ENSUED AND WE LEVELED OFF AT 10000'. LATER I PHONED THE APCH SUPVR AND WAS INFORMED THEY WERE CHKING THE TAPE. I CALLED BACK LATER AND THE SUPVR SAID; 'YOU WERE CLRD TO 5000'; THE CTLR MISTOOK YOU FOR COMPANY YXZ.' IT IS JUST HUMAN ERROR; AND LUCKILY NO HARM WAS DONE. HOWEVER; IT COULD JUST AS WELL BEEN MY ERROR. BUT; I'M SURE AS A PLT; I WOULD BE FINED OR GIVEN DISCIPLINARY ACTION BY THE FAA IF IT HAD BEEN! MY POINT IS; WE ARE ALL HUMAN; AND WE ALL MAKE UNINTENTIONAL MISTAKES! LET US USE THE POWER OF THE GOVERNMENT TO STOP FLAGRANT MISUSE AND VIOLATIONS OF THE LAW AND RULES; BUT NOT FOR SIMPLE HUMAN MISTAKES. I CERTAINLY DON'T WANT ANY FINES FOR MYSELF OR ANY APCH CTLR FOR A HUMAN ERROR. THAT WOULD SERVE NO PURPOSE! BOTH OUR TIME AND EFFORTS COULD BE PUT TO MUCH BETTER USE.",,,,"CTLR TRANSPOSED FLT NUMBERS OF SIMILAR A/N AND DESCENDED WRONG ACFT.",
81211,198801,0601-1200,MIA,FL,,,,0,,VMC,,,Daylight,,,Center ZMA,Air Carrier,Large Transport; Low Wing; 3 Turbojet Eng,,4 Or More,,IFR,Passenger,,Cruise; Cruise,Direct; Other Water,Class A ZMA,,,,,,,,,,,,,,,,,,,,,,,,,,,,,,,,,,,,,,,,,,,,,,,,,,,,,,,,,,,,,,,,,Air Carrier,Captain,Flight Crew Private; Flight Crew Instrument; Flight Crew Air Transport Pilot (ATP); Flight Crew Commercial,Flight Crew Last 90 Days 240; Flight Crew Total 21000; Flight Crew Type 8000,,,,,81211,,,Air Carrier,First Officer; Pilot Flying,Flight Crew Flight Engineer; Flight Crew Instrument; Flight Crew Commercial; Flight Crew Air Transport Pilot (ATP),Flight Crew Last 90 Days 250; Flight Crew Total 4500; Flight Crew Type 2500,,,,,81265,Deviation - Track / Heading All Types; Deviation / Discrepancy - Procedural Clearance,,,Person Air Traffic Control,,General None Reported / Taken,,Human Factors,"ON ARR AT THE ARPT OPS OFFICE; 40 MINS PRIOR TO SCHEDULED DEP; I AS THE CAPT OF THE FLT REVIEWED THE WX AND NOTAMS FOR DEP; ENRTE AND DEST ARPT. I DETERMINED THAT ADEQUATE FUEL AND RESERVES WERE PLANNED AND BOARDED MY ACFT; REVIEWED THE COMPUTER FLT PLAN AND DISPATCH RELEASE AND VERIFIED WITH OPS OFFICER THAT THE ATC OVERWATER FLT PLAN RTE; AS PER OUR DISPATCH RELEASE AND COMPUTER FLT PLAN; HAD BEEN PROPERLY FILED WITH ATC. THEN; I SIGNED THE DISPATCH RELEASE WHICH VERIFIES THAT I WAS IN AGREEMENT WITH OUR DISPATCHER; AND THE FUEL RELEASE AND OTHER INFO USED IN PLANNING OF OUR FLT. OUR ACFT WAS EQUIPPED WITH THE REQUIRED NECESSARY OVERWATER FLT EQUIP; AND I WAS IN AGREEMENT WITH OUR DISPATCHER ON HIS RTE SELECTION AS FURNISHED WITH OUR COMPUTER FLT PLAN. THIS IS A NORMAL PROC IN MIA; AS OUR FLT PLANS ARE FREQUENTLY NOT CTR STORED. THIS THEN REQUIRES THIS VERIFICATION PROC AND THE MANUAL FILING OF FLT PLANS WITH ATC BY OUR MIA OPS AND OUR DISPATCHER IN HOU. PERFORMED THE PREFLT CHKS; RECEIVED OUR START UP CLRNC AND TAXI INSTRUCTIONS AND; JUST PRIOR TO DEP AFTER SOME UNUSUAL DELAY; OUR ATC ARWYS CLRNC WHICH WAS GIVEN TO US FOR NOT THE OVERWATER RTE AS FILED; BUT RATHER FOR AN OVERLAND AND LONGER RTE FOLLOWING THE GULF COAST. I ACCEPTED THIS OVERLAND CLRNC FROM MIA CLRNC DELIVERY TO AVOID THE HASSLE OF A FURTHER DELAY; AND DEPARTED MIA INTL. SHORTLY THEN AFTER OUR DEP; AND WELL ABOVE THE TERMINAL AREA AND DEP TFC IN THE CONGESTED MIA AREA WHILE ENRTE TO LAKELAND; FL; I MADE A REQUEST OF ATC FOR A RERTE AND AMENDED CLRNC FOR THE SHORTER OVERWATER RTE TO HOU FOR WHICH WE HAD ORIGINALLY REQUESTED AND FILED; NAMELY DIR TO SARASOTA; J86 TO SABINE PASS; AND THE ARR RTE INTO HOU INTERCONTINENTAL FROM THE ATC CTR. I READ THE REQUESTED RERTE WHEN I WAS REQUESTED TO DO SO BY THE ATC CTLR; WHO THEN VERIFIED OUR RTE. THE ATC CTLR THEN AFTER BUT A MOMENT CAME BACK AND ISSUED US A NEW CLRNC AS REQUESTED OVER THE RERTE AS REQUESTED; COMPLETE WITH A FULL RTE READBACK. I AGAIN READ BACK THE NEW CLRNC TO HIM; AND WE THEN IMMEDIATELY PROCEEDED TO SARASOTA AS DIRECTED AND FLEW THE RERTED ATC CLRNC. AT NO TIME AFTER RECEIVING OUR RERTE CLRNC WERE WE ADVISED OF ANY FURTHER PROB OR QUESTION BY ATC WITH OUR FLT PLAN; AND OUR FLT WAS HANDLED BY ATC IN A VERY NORMAL MANNER. 2 DAYS AFTER OUR ARR; AND BY A TELEPHONE CALL FROM MY BASE ASS'T CHIEF PLT; I WAS MADE AWARE OF ANY ALLEGED IRREGULARITY OR INFRACTION; AND AM STILL UNAWARE OF ANY ERROR OR WRONG DOING ON MY PART; THAT OF MY COMPANY OR MY CREW. THE ACFT WAS FLOWN ON THIS LEG BY MY F/O; AND AT ALL TIMES WAS FLOWN ALONG THE RTES AND ARWYS AS CLRD BY ATC; NAMELY THE MIA DEP WITH RADAR VECTORS TO LAKELAND; THEN THE RERTE CLRNC AS REQUESTED AND RECEIVED FOR THE THEN PRESENT POS DIR TO SARASOTA; J86 TO SABINE PASS AND THE ARR INTO INTERCONTINENTAL ARPT HOU. CALLBACK CONVERSATION WITH RPTR REVEALED THE FOLLOWING: PIC COULD NOT ADD ANYTHING TO HIS RPT AND SAYS HE HAS NOT HEARD ANY MORE FROM THE FAA. THE COMPANY HAS TAKEN NO ACTION AGAINST THE FLT CREW. THE RPTR REPEATED THE CLAIM THAT GETTING A CLRNC FROM MIA IS DIFFICULT A LOT OF THE TIME; BUT HAVING RECEIVED THE DESIRED RE-CLRNC HE DOES NOT KNOW WHERE THIS SIT WENT WRONG.",,,,"ATC ALLEGES AN ACR LGT FAILED TO FLY THE ROUTE AS CLEARED. 4 FLT CREW CONFIRM THAT A RECLRNC WAS FILED; RECEIVED AND FLOWN AS GIVEN.",
81212,198801,1801-2400,AUS,TX,,2,,700,,VMC,,,Night,,,TRACON AUS; Tower AUS,Air Carrier,Medium Large Transport; Low Wing; 2 Turbojet Eng,,2,,IFR,Passenger,,Initial Approach,Visual Approach,Class C AUS; Class D AUS,,,,,,,,,,,,,,,,,,,,,,,,,,,,,,,,,,,,,,,,,,,,,,,,,,,,,,,,,,,,,,,,,Air Carrier,First Officer,Flight Crew Air Transport Pilot (ATP),Flight Crew Total 9000,,,,,81212,,,,Pilot Flying; Captain,Flight Crew Air Transport Pilot (ATP),,,,,,,Deviation - Track / Heading All Types; Deviation / Discrepancy - Procedural Clearance,,,Person Air Traffic Control; Person Flight Crew,,Flight Crew Returned To Clearance,Airport,Human Factors,"CAPT HAD NEVER BEEN TO AUSTIN. APCH CLRED US TO 2000' ABOUT 15 MI OUT; SO IT WAS HARDER TO SEE THE ARPT. WE WERE APCHING FROM THE NE AND CLRED FOR A VISUAL TO 13R. CAPT TUNED THE 13R LOC AND COMMENCED DSCNT ON WHAT HE THOUGHT WAS G/S FOR 13R. UNFORTUNATELY HE WAS LINED UP FOR 17. LIGHTS OF THE VASI AND RWY ON 17 WERE VERY BRIGHT AND THE ARPT IS IN THE CENTER OF THE CITY WITH MANY BRIGHT LIGHTS AROUND; MAKING IT DIFFICULT TO SEE RWY LIGHTS OF 13R. I TOLD HIM SEVERAL TIME HE WAS TOO LOW AND LINED UP FOR 17. HE BECAME CONFUSED WITH THE SITUATION AND TWR CALLED TO SAY WE APPEARED TO BE LINED UP FOR 17. I TOOK THE AIRPLANE AND LANDED ON 13R. WE WERE AT ABOUT 700' AND 2 MI OUT WHEN WE MANEUVERED FOR LNDG ON 13R. TWR OPERATOR SAID WE WEREN'T THE FIRST THAT NIGHT TO LINE UP ON 17 AS THE VASI LIGHTS ON 17 WERE TOO BRIGHT AND UNCONTROLLABLE AND LEADING PLTS ASTRAY. CAPT INTERCEPTED FALSE G/S BECAUSE HE WAS OUTSIDE OF G/S USABLE AREA AND CORRELATED IT WITH BRIGHT LIGHTS OF RWY STRAIGHT AHEAD DUE TO HIS UNFAMILIARITY WITH THE ARPT.",,,,"ACR MLG WRONG RWY APCH DUE TO CAPT UNFAMILIARITY WITH ARPT AND DIFFICULTY DISCERNING THE PROPER RWY BECAUSE OF CONBINATION OF CITY AND ARPT LIGHTING.",
81216,198801,1201-1800,SMA; LAX,CA,261,10,,6200,,VMC,20,,Daylight,,,Center ZLA; TRACON LAX,Air Carrier,Widebody; Low Wing; 3 Turbojet Eng,,3,,IFR,Ferry / Re-Positioning,,Cruise; Cruise; Descent; Descent,Other Profile Descent,Class E ZLA; Class E LAX,,,,,,,,,,,,,,,,,,,,,,,,,,,,,,,,,,,,,,,,,,,,,,,,,,,,,,,,,,,,,,,,,Air Carrier,Pilot Flying; Captain,Flight Crew Air Transport Pilot (ATP); Flight Crew Instrument,Flight Crew Last 90 Days 38; Flight Crew Total 25000; Flight Crew Type 600,,,,,81216,,,Air Carrier,First Officer,Flight Crew Air Transport Pilot (ATP),Flight Crew Last 90 Days 230; Flight Crew Total 10050; Flight Crew Type 450,,,,,81140,Deviation - Altitude Overshoot; Deviation / Discrepancy - Procedural Published Material / Policy; Deviation / Discrepancy - Procedural Clearance,,,Person Air Traffic Control,,Air Traffic Control Issued New Clearance,,Human Factors,"GEAR DOWN MAINT FERRY SEA-LAX CLRD FOR DES PROFILE TO LAX. CAPT FLYING; F/O READING PLATES. JUST PAST FILLMORE VOR LAX CENTER ASKED ALT. F/O RESPONDED 6200'. LAX CENTER SAID MAINTAIN 7000'. WE IMMEDIATELY CLBED TO 7000'. LAX CENTER ASKED ME TO CALL THEM. I DID AND THEY SAID A PLT DEV PACKAGE WOULD BE SENT TO FSDO. THERE WAS NO CONFLICT WITH OTHER TFC OR ANY TERRAIN. MEA 5000'. PROFILE CHART IS VERY MISLEADING AND F/O MUST HAVE MISREAD RWY 25/24 PROFILE DES CHART. ACCORDING TO CHART (10-2F PROFILE DES 24/25); FILLMORE VOR HAS XING RESTRICTIONS AT OR BELOW 21000'; AT OR ABOVE 15000'. THEN; 5000'; EXCEPT BAYST INTXN MUST BE CROSSED AT 10000'. (SEE ENCLOSED CHART.) SUPPLEMENTAL INFORMATION FROM ACN 81140: NONE OF THE FLT CREW MEMBERS HAD ANY EXPERIENCE WITH PROFILE DESCENTS. WE BECAME CONFUSED ON READING SEGMENT ALTS; READING THE MEA AS THE REQUIRED ALT.",,,,"FLT CREW FAILED TO COMPLY WITH ALT RESTRICTION DEPICTED ON THE PROFILE DESCENT.",
