80826,198801,1201-1800,IAH,TX,,,0,,,VMC,,,Daylight,,,,Air Carrier,Large Transport; Low Wing; 3 Turbojet Eng,,3,,IFR,Passenger,,Landing; Landing,,,,,,,,,,,,,,,,,,,,,,,,,,,,,,,,,,,,,,,,,,,,,,,,,,,,,,,,,,,,,,,,,,,Air Carrier,Pilot Flying; Captain,Flight Crew Air Transport Pilot (ATP),Flight Crew Last 90 Days 250; Flight Crew Total 11000,,,,,80828,,,Air Carrier,First Officer,Flight Crew Flight Engineer; Flight Crew Air Transport Pilot (ATP),Flight Crew Last 90 Days 180; Flight Crew Total 6000; Flight Crew Type 700,,,,,80535,Aircraft Equipment Problem Less Severe; Other Unspecified,,,Person Flight Crew,,Aircraft Aircraft Damaged; General None Reported / Taken,,Aircraft,"WHILE LNDG AT IAH ARPT ON RWY 8; AFT GALLEY CART CAME THROUGH COCKPIT DOOR WHEN BRAKES AND ENGINE THRUST WERE APPLIED A/C CONTINUED NORMAL LNDG ROLL AND CLRD RWY. APPROPRIATE CHECKLISTS WERE COMPLETED AND MAINT NOTIFIED. NO INJURIES TO DEAD HEADING CABIN CREW MEMBERS NOR TO THREE COCKPIT MEMBERS FLYING. LOGBOOK ENTRY MADE ACCORDINGLY. AFTER BLOCKING IN AT GATE AND REVIEWING DAMAGE DONE TO A/C; TALKING WITH DEAD HEADING CABIN CREW MEMBERS; AND MAINT PERSONNEL WHO HAD JUST BOARDED A/C; IT SEEMS AFT GALLEY CART ROLLED OUT OF ITS STOWED POSITION AND DURING A SERIES OF LEFT TURNS FOLLOWED BY LEVEL FLT WAS ABLE TO POSITION ITSELF WHEREIN IT WAS DIRECTLY IN LINE TO ROLL DOWN THE ISLE WITHOUT HITTING ANY SEAT TO HINDER ITS FORWARD PROGRESS. FURTHER REVIEW CONFIRMED THAT THERE WERE NO SEATS DAMAGED IN ANY MANNER! A VISUAL CHECK HAD BEEN MADE PRIOR TO DESCENT AND NO GALLEY CART WAS SEEN OUT IN THE ISLE. AS THIS WAS A FERRY FLT FOR MAINT; THE DEAD HEADING CABIN CREW HAD BEEN SEATED IN FIRST CLASS AND WERE IN THEIR SEATS FROM APPROX 10000' DOWN TO LNDG.",,,,"INFLT CABIN SERVICE MODULE CAME LOOSE AND CRASHED THROUGH COCKPIT DOOR ON LNDG DECELERATION.",
80829,198801,0601-1200,EWR,NJ,,5,,4000,,VMC,20,,Daylight,,,TRACON N90,Air Carrier,Light Transport; Low Wing; 2 Turboprop Eng,,2,,IFR,Passenger,,Initial Climb; Takeoff / Launch,,Class B N90,,,,,,,,,,,,,,,,,,,,,,,,,,,,,,,,,,,,,,,,,,,,,,,,,,,,,,,,,,,,,,,,,Air Carrier,First Officer; Pilot Flying,Flight Crew Air Transport Pilot (ATP),Flight Crew Last 90 Days 200; Flight Crew Total 2900; Flight Crew Type 530,,,,,80829,,,,Captain,Flight Crew Air Transport Pilot (ATP),,,,,,,Deviation - Altitude Overshoot; Deviation / Discrepancy - Procedural FAR; Inflight Event / Encounter Weather / Turbulence,,,Person Air Traffic Control; Person Flight Crew,,Flight Crew Returned To Clearance,,Human Factors,"IT WAS MY FIRST LEG FROM EWR TO BWI. WE WERE CLRD FOR TKOF AND EXECUTED THE STANDARD SID; RIGHT TO 060 DEGS AND UP TO 2500'. ONCE REACHING THIS ALT WE WERE TOLD TO TURN LEFT TO 340 DEGS AND UP TO 4000'. I WAS CLBING AS FAST AS ALLOWABLE TO GET OUT OF THE TURBULENCE. APCHING 3500' THE CAPT WENT TO COMPANY FREQ AND LEFT THE RADIOS AND THE AIRPLANE TO ME. AT THIS POINT ONE OF THE FRICTION LOCKS WORKED LOOSE AND THE SPD (PROPS) WENT WAY OUT OF SYNC. AT THIS POINT WE ARE SUPPOSED TO BE AT 100% RPM. ONE PROP WENT TO 101 DEGS; THE OTHER BACK TO 97%. THE CAPT STAYED ON COMPANY AND OFFERED NO ASSISTANCE. SO; I TRIED TO ADJUST THEM MYSELF. DEALING WITH THIS IN TURBULENCE WAS A LITTLE TOO MUCH AND I WENT THROUGH 4000'. THE CAPT NOTICED AND SWITCHED THE MODE C OFF AND I REDUCED PWR AND GOT BACK TO OUR 4000'. I BUSTED BY 400'. THE CTLR CALLED TFC AT 1 O'CLOCK AND 5 MI AT 5000'. I ALREADY HAD THIS TFC IN SIGHT. SHE AGAIN TOLD US TO MAINTAIN 4000'. I DID BUST THE ALT; BUT THE CAPT SHOULD HAVE BEEN INSIDE THE AIRPLANE; NOT LOOKING OUT THE WINDOW AND TALKING TO COMPANY. COMPANY OPERATIONS STATES THAT THE COMPANY CALLS ARE NOT TO BE MADE UNTIL OUTSIDE OF THE ATA. 1 1/2 MI OUT IS A LITTLE HASTY FOR ME.",,,,"ALT OVERSHOT ON CLIMBOUT. CAPT TURNED OFF MODC C DURING OVERSHOOT.",
80834,198801,0601-1200,CAK,OH,,20,,1230,,VMC,,,Daylight,,,Center ZOB; TRACON CAK,Air Carrier,Medium Transport; Low Wing; 2 Turboprop Eng,,2,,IFR,Passenger,,Takeoff / Launch; Cruise; Cruise; Climb,Airway ZOB,Class E CAK,,,,,,,,,,,,,,,,,,,,,,,,,,,,,,,,,,,,,,,,,,,,,,,,,,,,,,,,,,,,,,,,,Air Carrier,Captain,Flight Crew Air Transport Pilot (ATP),Flight Crew Last 90 Days 40; Flight Crew Total 12800,,,,,80834,,,,Pilot Flying; First Officer,Flight Crew Commercial; Flight Crew Instrument,,,,,,,Aircraft Equipment Problem Less Severe; Other Unspecified,,,Person Flight Crew,,General None Reported / Taken,,Aircraft,"AFTER TKOF I WAS UNABLE TO MOVE THE LNDG GEAR HANDLE ON THE MDT FROM THE EXTEND TO THE RETRACT POS. I ASSUMED THE PF FLYING DUTIES AND THE F/O REFERENCED BOTH OUR COMPANY QRF (QUICK REFERENCE MANUAL) AND MDT PLT HANDBOOK FOR A PROC TO FOLLOW. HE COULD FIND NONE. AT THIS POINT I GAVE HIM THE CTLS AND I ASSUMED THE PNF DUTIES. I DECIDED TO CONTINUE TOWARD DTW WHILE I TROUBLESHOT THE PROBLEM. WX AT TKOF; DEST AND OUR ALTERNATES WAS VFR WITH ARPTS SURROUNDING OUR DEST ALSO REPORTING VFR. NO ICING WAS ENCOUNTERED DURING OUR CLB TO VFR CONDITIONS ON TOP OF CLOUDS. BY THE TIME WE HAD EXHAUSTED OUR ATTEMPTS TO RETRACT THE GEAR USING NORMAL MEANS; WE WERE ALREADY 1/2 THE SHORT DISTANCE BTWN CAK-DTW. NOTE: I DID NOT WANT TO REMOVE THE SIDE PANEL AND MOVE THE ANTIRETRACT PLUNGER TO GET THE GEAR TO RETRACT UNLESS A GREATER EMER AROSE. AFTER CONSIDERING ALL OF THE FACTORS (ACFT PERFORMANCE; WX AND FUEL) WITH THE INFO AVAILABLE TO ME; I ELECTED TO CONTINUE TO MY DEST. NOTE: THERE ARE NUMEROUS ARPTS ALONG MY FLT ROUTE THAT I COULD HAVE USED HAD I LOST AN ENG WITH THE GEAR EXTENDED AND HAD ANY PROBS PERFORMANCE WISE. AS I MENTIONED EARLIER; I DON'T FEEL LIKE I'VE DONE ANYTHING WRONG; BUT I WANTED THE RPT FILED JUST IN CASE I DID VIOLATE ANY FAR.",,,,"UNABLE TO RAISE GEAR HANDLE AFTER TKOF. CONTINUED TO DESTINATION.",
80837,198801,0001-0600,FWA,IN,,5,,1180,,IMC,2,,Night,500,,TRACON FWA; Tower FWA,Air Carrier,Heavy Transport; Low Wing; 4 Turbojet Eng,,3,,IFR,Cargo / Freight / Delivery,,Initial Approach; Landing,,Class C FWA; Class D FWA,,,,,,,,,,,,,,,,,,,,,,,,,,,,,,,,,,,,,,,,,,,,,,,,,,,,,,,,,,,,,,,,,Air Carrier,First Officer; Pilot Flying,Flight Crew Instrument; Flight Crew Commercial; Flight Crew Flight Engineer,Flight Crew Last 90 Days 120; Flight Crew Total 7000; Flight Crew Type 1120,,,,,80837,,,,Captain,Flight Crew Air Transport Pilot (ATP),,,,,,,Conflict Ground Conflict; Less Severe; Deviation - Altitude Overshoot; Deviation / Discrepancy - Procedural Published Material / Policy; Inflight Event / Encounter Weather / Turbulence,,,Person Air Traffic Control,,Air Traffic Control Issued New Clearance; Flight Crew Returned To Clearance; Flight Crew Executed Go Around / Missed Approach,,Human Factors,"ON ARR AT DEST ARPT I WAS THE PF A HVY CARGO AIRPLANE AND RPTED WX ON ARPT ATIS READ 5 OVCST 2; -RF 45/41; 200/13; 29.41; LOC B/C RWY 14. DURING DES APCH AND FINAL WX WAS -RF AND TURBULENCE. THE APCH WAS FLOWN OBSERVING DME FIXES AND ALTS. SHORTLY AFTER PASSING THE 5.0 DME FIX AND DSNDING TO MDA THE WIND WAS NOW RPTED TO BE 260/14G23. I CONTINUED APCH DOWN TO THE MDA WITH GND CONTACT ESTABLISHED PRIOR TO THE 5.0 DME FIX. AT ABOUT 400' AGL WITH GOOD VISUAL SIGHTING OF RWY 14; XWIND FACTOR WAS EVIDENT TO BE VERY STRONG AND NOT SUITABLE FOR RWY LENGTH AND PREVAILING WET CONDITIONS. BOTH CAPT AND F/O CALLED FOR A MISSED APCH; PWR APPLIED; FLAPS 25 DEGS; PITCH UP; POSITIVE RATE; GEAR UP. MISSED APCH PUBLISHED ALT WAS 3000'. AT 3000' LCL APCH CALLED 'MAINTAIN 2500' RWY HDG.' THIS WAS NOT PER THE MISSED APCH ALT AND FOR A MOMENT IT WAS THOUGHT TO BE A POSSIBLE ERROR. CTLR THEN CALLED BACK SAYING MAINTAIN 3000' RWY HDG AND HANDED US OVER TO ANOTHER CTLR. DURING THIS TIME MY ALT BALLOONED UP APPROX 300-400'; BUT SHORTLY WAS BROUGHT BACK TO 3000'. I CONTINUED FLYING VECTORS FOR A VOR RWY 23 APCH WHICH WAS EXECUTED WITH A LNDG AND FULL STOP. WHILE WE WERE TAXIING IN THE TWR REQUESTED CAPT'S NAME AND ACFT REGISTRATION NUMBER. CAPT CONTACTED TWR ON THE LANDLINE AND WAS INFORMED THAT THEY HAD RECEIVED AN ALT LOW ALERT WARNING DURING APCH PHASE AND HAD OBSERVED ALT EXCURSION DURING THE MISSED APCH PROC. FOLLOWING FAC PROCS THEY WERE REQUIRED TO FORWARD A RPT TO THE SECTOR SUPVR AT SOUTH BEND. CAPT DISCUSSED EVENTS WITH LCL CTL AND ALSO INFORMED COMPANY CHIEF PLT. THIS RPT IS INTENDED TO EXPLAIN THOSE EVENTS AND OFFER SUGGESTIONS TO PREVENT FUTURE OCCURRENCE DURING MISSED APCH MANEUVERS. ACFT LNDG WT WAS APPROX 189000#; COMPANY TRAINERS MANUAL AND PROCS CALL FOR ALWAYS STANDARD MAX PWR DURING MISSED APCH. IT IS POSSIBLE THAT THE AMOUNT OF PWR USED; LIGHT ACFT WT; GUSTY WIND CONDITIONS AND TURBULENCE; COUPLED WITH SUCH A SHORT ALT CHANGE (APT ELEVATION 815'); CONTRIBUTED TO MY ALT EXCURSION; AS WELL AS THE REQUEST FOR A LOWER THAN PUBLISHED MISSED APCH ALT. (MSA ALL QUADRANTS WAS 2900'.) GREATER VIGILANCE ON ALT CTL BY MYSELF AND CLRNC TO THE PUBLISHED MISSED APCH ALT WOULD HAVE PREVENTED THIS UNHAPPY EVENT. NO OTHER ACFT WERE INVOLVED. WE WERE #1 FOR THAT APCH. THE ACFT BEHIND US ELECTED TO TAKE APCH TO RWY 23. A WX SHIFT OR SQUALL APPEARED TO CROSS OVER THE FIELD JUST PRIOR TO OUR APCH AND LNDG; FURTHER COMPLICATING BOTH OUR PROCS AND EVENTS.",,,,"GPWS SOUNDED DURING MISSED APCH PROC. TURBULENCE; STRONG CROSSWIND A FACTOR.",
80839,198801,1801-2400,SEA,WA,,,0,,,VMC,,,Night,,,Tower SEA,Air Carrier,Medium Large Transport; Low Wing; 2 Turbojet Eng,,2,,IFR,Passenger,,Parked,,,,,,,,,,,,,,,,,,,,,,,,,,,,,,,,,,,,,,,,,,,,,,,,,,,,,,,,,,,,,,,,,,,Air Carrier,Captain,Flight Crew Flight Engineer; Flight Crew Commercial; Flight Crew Air Transport Pilot (ATP),Flight Crew Last 90 Days 250; Flight Crew Total 18000; Flight Crew Type 900,,,,,80839,,,Air Carrier,First Officer,Flight Crew Air Transport Pilot (ATP),Flight Crew Last 90 Days 200; Flight Crew Total 6000; Flight Crew Type 2000,,,,,80840,Aircraft Equipment Problem Less Severe,,,Person Other Person,,Flight Crew Overcame Equipment Problem,,Human Factors,"TO CONSERVE FUEL; ONE ENG IS STARTED AT THE GATE AND THE SECOND ENG AT THE RWY. OUR APU WAS INOP. NOT WANTING TO DISTURB THE ACFT BEHIND US; WE WAITED UNTIL WE WERE BETWEEN RWY 34R AND 34L. AT SEA TO RUNUP THE OPERATING ENG FOR A CROSSBLEED START. THE ENG WOULD NOT START. FURTHER CHKING REVEALED THAT THE IGNITION SWITCH HAD NOT BEEN ON. WHILE ATTEMPTING ANOTHER START; AN ACFT CALLED AND SAID WE HAD A POSSIBLE TAILPIPE FIRE. THE START ATTEMPT WAS STOPPED WHILE CONTINUING TO CRANK TO CLR THE ENG OF FUEL. I HEADED BACK TOWARD THE RAMP. THE FIRE CREW MET ME ON THE RAMP AND SAID THERE WAS NO EVIDENCE OF A FIRE. WHILE THE FIRE CREW WAS THERE; ANOTHER START WAS ATTEMPTED AND WAS SUCCESSFUL. SINCE I KNEW THE PROBLEM HAD BEEN CREATED BY US AND THERE WAS NOTHING WRONG WITH THE ACFT; I DECIDED TO TKOF AND CONTINUE THE TRIP. I PROBABLY LEFT MYSELF OPEN TO CRITICISM BY NOT RETURNING TO THE GATE AND HAVE MAINT LOOK AT THE ENG BEFORE ATTEMPTING ANOTHER START. IF I HAD IT TO DO OVER AGAIN; I PROBABLY WOULD RETURN TO THE GATE. I THINK THE FACTORS HERE ARE TWO MAN CREW; NIGHT TIME; CROSS BLEED START AT THE END OF THE RWY; ATTEMPTING TO SAVE FUEL TO AN EXTENT NOT NECESSARY. THIS KIND OF A SITUATION IS TOO BUSY AND THINGS GET IN TOO MUCH OF A HURRY FOR A TWO MAN CREW. AFTER THE PROBLEM HAD BEEN CORRECTED; EVERYTHING POINTED TO THE FACT THAT NOTHING WAS WRONG WITH THE ENG. SO MY JUDGEMENT WAS WHY DELAY ANY FURTHER BECAUSE I THOUGHT IT WAS SAFE. HOWEVER; I SHOULD HAVE TAKEN MORE TIME TO CONSIDER ALL THE ASPECTS OF ONE HUNDRED PERCENT SAFETY. CALLBACK CONVERSATION WITH RPTR REVEALED THE FOLLOWING: F/O VERY EXPERIENCED ON THE ACFT; FAILED TO SHUT OFF THE FUEL LEVER WHEN HE NOTICED THE ENG DID NOT LIGHT UP. AS A RESULT WHEN HE REALIZED HIS ERROR IN NOT ARMING THE IGNITERS AND TURNING THEM ON; FUEL HAD ACCUMULATED IN THE TAIL PIPE WHICH IGNITED CAUSING THE FIRE TO SHOOT OUT THE TAIL OF THE ENG. AS SOON AS THE OTHER ACFT RPTED THE FIRE; THE CAPT SHUT OFF THE FUEL LEVER AND ADVISED THE F/O TO CONTINUE MOTORING THE ENG TO BLOW OUT THE EXCESS FUEL. NO EGT LIMITS WERE EXCEEDED AND AFTER INSPECTION BY THE FIRE CREW THE FLT DEPARTED. RPTR DOES NOT LIKE THE TWO MAN CREW CONCEPT; BUSY COCKPIT AND IN THE FUTURE IN A SIMILAR INCIDENT; WILL RETURN TO THE GATE FOR MAINT INSPECTION OF THE ENG. NO PROB ON THIS FLT AND THE COMPANY IS TAKING NO ACTION.",,,,"FLT CREW FAILED TO ARM IGNITERS RESULTING IN FUEL ACCUMULATION IN THE TAIL PIPE AND FIRE OUT THE TAIL CONE WHEN IGNITERS WERE TURNED ON.",
80853,198801,0601-1200,ESP,PA,310,1,300,,,VMC,,,Daylight,,,,Personal,Small Aircraft; High Wing; 1 Eng; Fixed Gear,,1,,None,Personal,,Initial Climb,,Class G ESP,,,,,,,,,,,,,,,,,,,,,,,,,,,,,,,,,,,,,,,,,,,,,,,,,,,,,,,,,,,,,,,,,Other Compensated GA,Single Pilot; Pilot Flying,Flight Crew Air Transport Pilot (ATP),Flight Crew Last 90 Days 93; Flight Crew Total 15000; Flight Crew Type 112,,,,,80853,,,,,,,,,,,,Inflight Event / Encounter Weather / Turbulence; Inflight Event / Encounter CFTT / CFIT,,,Person Flight Crew,,Flight Crew Regained Aircraft Control,,Weather,"I ENCOUNTERED A DANGEROUS CONDITION WHEN I TOOK OFF ON RWY 31 WITH THE WIND OUT OF THE NW; AFTER SPEAKING WITH A PLT WHO WAS FAMILIAR WITH THE ARPT AND ALSO OBSERVING THE ARPT MGR TKOF ON A SIGHTSEEING FLT CARRYING TWO PASSENGERS. THERE IS RISING TERRAIN OFF THE NW END OF THE ARPT AND WHEN THE WIND IS OUT OF THE NW; UNPREDICTABLE WINDSHEARS AND DOWN DRAFTS OFTEN OCCUR. AFTERWARDS I LEARNED OF THIS FREQUENT OCCURRENCE; THERE HAVE BEEN A NUMBER OF INCIDENTS INVOLVING THIS DANGEROUS CONDITION. PLTS SHOULD BE WARNED THAT THIS CONDITION OFTEN EXISTS SO THAT THEY CAN TAKE IT INTO CONSIDERATION IN DECIDING WHEN IT IS SAFE TO USE THAT RWY.",,,,"GA SMA ENCOUNTERED WIND SHEAR DOWNDRAFT ON INITIAL CLIMB AFTER TKOF.",
80854,198801,0601-1200,JMS,ND,,,0,,,,,,,,,,,,,,,,,,,,,,,,,,,,,,,,,,,,,,,,,,,,,,,,,,,,,,,,,,,,,,,,,,,,,,,,,,,,,,,,,,,,,Government,FSS,,,,,,,80854,,,,,,,,,,,,Other No Specific Anomaly Occurred,,,Person Air Traffic Control,,General None Reported / Taken,,Airport,"THIS IS WRITTEN SOLELY TO EXPRESS CONCERN BROUGHT ABOUT BY RECENT EVENTS PERTAINING TO THE CONSOLIDATION OF FLT SVC STATIONS THROUGHOUT THE UNITED STATES. LOCALLY; THE FLT SVC STATION AT JAMESTOWN WILL BE CLOSING ON MARCH TUE 1988. NOT AT THIS STATION; BUT AT SEVERAL OTHERS; AIRLINES AND AIRLINE PERSONNEL WILL BE TAKING THE CONTRACTS FOR PROVIDING WX OBSERVATIONS. I HAVE NOTED ON VARIOUS OCCASIONS AT OUR STATION WHERE AIRLINE PERSONNEL (THE AIRLINE FLIES COMMUTER FLTS FOUR TIMES DAILY; AND THEY SHARE THE SAME BUILDING AT THE ARPT THAT WE OCCUPY) HAVE COME OVER ASKING US TO UP THE WX A BIT SO THAT THE FLT CAN GET IN OR OUT. ALL SPECIALISTS AT THIS STATION HAVE NOTICED THIS; AND ALL HAVE REFUSED TO CHANGE THE RPT. THIS HAS NOT LED TO A BIG SCENE OR ANYTHING; BUT IT DOES RAISE THE QUESTION OF WHAT WILL OCCUR (OR DOES OCCUR) AT STATIONS WHERE THE AIRLINE DOES OR WILL BE DOING WX OBSERVATIONS. CONSIDER THIS SITUATION. AN AIRLINER IS DUE IN AT AN ARPT. WX THAT IS NEEDED FOR THE APCH IS 200 AND 1/2 MI. ACTUAL WX IS JUST BELOW THAT. AIRLINE WX OBSERVERS PUT IN 200-1/2 ON THEIR OBSERVATION. THAT GETS TRANSMITTED ON THE CIRCUIT. A LOW TIME IFR PLT SEES THAT RPT; HAS LITTLE IFR IN INSTRUMENT CONDITIONS; DECIDES TO SHOOT APCH. GRANTED; WHEN THE IFR PLT REACHES DECISION HEIGHT; HE SHOULD EXECUTE MISSED APCH; BUT THE WX RPT BEING INACCURATE; THAT TAKES AWAY SOME OF THE SAFETY BUILT INTO THE SYS. IF SOMETHING GOES WRONG; AND AN ACCIDENT OCCURS; THE ERROR WOULD BE ON THE PART OF THE PLT; EVEN THOUGH THE ACTUAL WX MAY BE LOWER THAN INDICATED. COULD BE A PROBLEM SOMETIME.",,,,"WX OBSERVATIONS MADE BY QUALIFIED AIRLINE PERSONNEL.",
80855,198801,,DEN,CO,,5,3000,,,IMC,8,,Daylight,2500,,TRACON DEN,Air Carrier,Medium Large Transport; Low Wing; 2 Turbojet Eng,,2,,IFR,Passenger,,Initial Approach,Vectors,Class B DEN; Class D DEN,,,,,,,,,,,,,,,,,,,,,,,,,,,,,,,,,,,,,,,,,,,,,,,,,,,,,,,,,,,,,,,,,Air Carrier,First Officer,Flight Crew Air Transport Pilot (ATP),Flight Crew Last 90 Days 60; Flight Crew Total 6500; Flight Crew Type 200,,,,,80855,,,,Captain; Pilot Flying,Flight Crew Air Transport Pilot (ATP),,,,,,,Deviation - Track / Heading All Types; Other Unspecified,,,Person Flight Crew,,,,Human Factors,"DEN STAPLETON WAS LNDG RWYS 8 WHEN WE FIRST CHKED ATIS DURING DES. WE WERE SUBSEQUENTLY ADVISED TO HOLD AT RAMAH; (SEE THE PROFILE DES) AS DEN HAD SHUT OFF ALL ARRS. AFTER NEARLY 30 MINS OF HOLDING WE WERE NOTIFIED VIA ATIS THAT DEN STAPLETON WAS SWITCHING LNDG RWYS TO 26L & R. SHORTLY WE WERE CLRD FOR THE PROFILE AND ADVISED TO PLAN RWY 35R. UPON TUNING FOR THE LOC I INCORRECTLY SET THE FREQ FOR THE LEFT RWY (35L). AS I WAS UNABLE TO IDENTIFY THE LOC (35L WAS APPARENTLY NOT ON THE AIR); THE CAPT TUNED HIS RECEIVER AND MADE THE SAME ERROR I HAD--THAT IS HE SET THE FREQ FOR 35L. NEITHER OF US CAUGHT THE ERROR UNTIL AFTER WE WERE CLRD FOR THE APCH. IN DISCUSSING THE WHOLE EPISODE WITH THE CAPT LATER I WAS NOT AT ALL SURPRISED THAT HE HAD BEEN LED INTO THE ERROR THE SAME WAY I HAD--WHEN CHKING THE APCH PLATE I HAD LOOKED AT THE RIGHTHAND PAGE (RWY 35L) INSTEAD OF THE LEFTHAND PAGE (RWY 35R). I BELIEVE 3 FACTORS CONTRIBUTED TO THIS INCIDENT: NO COM FROM ATC ALLOWING US TIME TO PROPERLY ORIENT OURSELVES TO THE APCH PLAN. THE RWY CHANGES WERE NOT ANNOUNCED BY APCH CTL. ONLY WHEN WE RECEIVED OUR VECTOR TO FINAL WERE WE ADVISED OF WHICH RWY TO PLAN. THE LAYOUT OF THE APCH PLATES FOR RWYS 35R AND 35L IN OUR COMMERCIAL CHART MANUAL IS ILLOGICAL! WHY NOT PRINT THE SEQUENCE SO THAT THE 35R APCH IS THE RIGHTHAND PAGE AND THE 35L APCH PLATE IS THE LEFTHAND PAGE? GENERAL UNFAMILIARITY WITH THIS APCH. I HAD USED THIS APCH ONLY ONCE BEFORE WITHIN THE PREVIOUS SEVERAL MONTHS. SIGNIFICANT IS THE FACT THAT BOTH THE CAPT AND MYSELF MADE THE SAME ERROR.",,,,"ACR MLG FLT CREW TUNED WRONG ILS FREQ.",
80858,198801,1201-1800,MIA,FL,,,0,,,,,,Daylight,,,,Air Carrier,Widebody; Low Wing; 2 Turbojet Eng,,3,,,Passenger,,Parked,,,,,,,,,,,,,,,,,,,,,,,,,,,,,,,,,,,,,,,,,,,,,,,,,,,,,,,,,,,,,,,,,,,Air Carrier,Flight Attendant (On Duty),Other Other,,,,,,80858,,,,,,,,,,,,Aircraft Equipment Problem Less Severe; Deviation / Discrepancy - Procedural FAR,,,Person Flight Crew,,General None Reported / Taken,,,"THE ACFT L-1 DOOR HAS BEEN WRITTEN UP 9 TIMES. WAS TO BE RESEALED AT NEXT AVAILABLE STATION. THIS PROB WAS ONLY RELUBRICATED. THE LOGBOOK CAN ATTEST TO WHAT TOOK PLACE. HOPEFULLY IT HAS BEEN REPLACED BY NOW.",,,,"REPORTER STATES THAT CABIN DOOR LEAK HAS BEEN WRITTEN UP 9 TIMES AND ALL REPAIRS HAVE BEEN UNSUCCESSFUL.",
80861,198801,1801-2400,MDT,PA,,,0,,,VMC,15,,Night,,,Tower MDT,Air Carrier,Light Transport; Low Wing; 2 Turboprop Eng,,2,,IFR,Passenger,,Takeoff / Launch,,,,,,,,,,,,,,,,,,,,,,,,,,,,,,,,,,,,,,,,,,,,,,,,,,,,,,,,,,,,,,,,,,,Air Carrier,Captain; Pilot Flying,Flight Crew Air Transport Pilot (ATP),Flight Crew Last 90 Days 215; Flight Crew Total 3600; Flight Crew Type 2300,,,,,80861,,,,First Officer,Flight Crew Commercial; Flight Crew Instrument,,,,,,,Deviation / Discrepancy - Procedural Clearance; Ground Incursion Runway,,,Person Air Traffic Control,,General None Reported / Taken,,Human Factors,"IT WAS THE LAST LEG OF THE DAY FROM MDT TO HGR. AS WE TAXI OUT TO THE RUN UP BLOCK WE PULLED BEHIND ANOTHER COMMUTER AND CALLED READY IN SEQUENCE. THEN WE WERE CLRD INTO POS AND HOLD. AS WE PULLED ONTO THE RWY MY F/O BROUGHT THE SPEEDERS UP AND THE LIGHTS ON AND TOLD ME WE WERE CLRD TO GO. I THEN ADVANCED PWR AND TOOK OFF. MDT TWR ADVISED ME I WAS NOT CLRD TO GO; AND TO CONTACT DEP. NO EVASIVE ACTION WAS NEEDED. I BELIEVE THE REASON I DID NOT HEAR THE CALL CLEARLY WAS BECAUSE OF THE TAXI AROUND THE COMMUTER IN FRONT OF ME WAS SOMEWHAT TIGHT. AND; MY MISTAKE WAS NOT TO CONFIRM THE CLRNC. AFTER TALKING TO MY F/O; HE BELIEVED HE HEARD CLRD TO GO. OCCASIONALLY; CTLRS USE THE PHRASE 'CLRD TO GO;' NOT PUTTING ANY BLAME ON THEM. I SEE THE IMPORTANCE OF USING CORRECT PHRASES ALL THE TIME BTWN CTLRS AND PLTS.",,,,"COMMUTER TKOF WITHOUT CLRNC.",
80877,198801,1801-2400,ORD,IL,,30,,16000,,VMC,,,Night,,,Center ZAU,Corporate,Small Transport; Low Wing; 2 Turboprop Eng,,2,,IFR,Passenger,,Climb; Cruise; Cruise,Other Departure,Class E ZAU,,,,,,,,,,,,,,,,,,,,,,,,,,,,,,,,,,,,,,,,,,,,,,,,,,,,,,,,,,,,,,,,,Other Compensated GA,Captain,Flight Crew Air Transport Pilot (ATP),Flight Crew Last 90 Days 150; Flight Crew Total 10000,,,,,80877,,,,Pilot Flying; First Officer,Flight Crew Commercial; Flight Crew Instrument,,,,,,,Aircraft Equipment Problem Critical; Deviation - Altitude Overshoot; Inflight Event / Encounter Weather / Turbulence,,,Person Flight Crew,,Flight Crew Regained Aircraft Control; Flight Crew Returned To Clearance,,Weather,"AFTER TKOF FROM CHICAGO ORD; THE CHICAGO CTR CLRED US TO 16000' OUR CRUISE ALT. THE CLIMBOUT WAS IN WET HEAVY SNOW (SLUSH) AT 16000'; WE WERE UNABLE TO LEVEL OFF BECAUSE THE CONTROLS HAD FROZEN. THE ACFT CLIMBED TO 16700' OF ALT BEFORE WE COULD FREE THE CONTROLS.",,,,"CPR SMT EXPERIENCED FROZEN CONTROLS WHILE ATTEMPTING TO LEVEL OFF.",
80881,198801,1801-2400,CSN; IAD,VA,,20,,7000,,VMC,60,,Night,,,TRACON IAD,Air Carrier,Large Transport; Low Wing; 3 Turbojet Eng,,3,,IFR,Passenger,,Descent; Initial Approach; Descent,Vectors,Class E IAD,,,,,,,,,,,,,,,,,,,,,,,,,,,,,Military,Any Unknown or Unlisted Aircraft Manufacturer,,,,,,,Cruise,,,,,,,,,,,,,,,,,,,,,,,,,,,,Air Carrier,Captain,Flight Crew Air Transport Pilot (ATP),Flight Crew Last 90 Days 151; Flight Crew Total 27886; Flight Crew Type 7000,,,,,80881,,,,Pilot Flying; First Officer,Flight Crew Instrument; Flight Crew Commercial,,,,,,,Conflict Airborne Conflict,Horizontal 100; Vertical 200,,Person Flight Crew,,General None Reported / Taken,,Human Factors,"ON ATC HDG OF 010 DEG DSNDING TO 6000'; CLR NIGHT 60 MI VISIBILITY. ACFT ABOVE US ABOUT 10-15 MI IN OUR 10 O'CLOCK POS CLOSING WITH RELATIVE POS REMAINING CONSTANT; ACFT DSNDED TO NEAR OUR ALT; CROSSED OVER US ABOUT 200' MAKING A 30 DEG PLUS ANGLE BANK TURN LEFT TO PARALLEL OUR COURSE. WE ASKED ATC IF THEY HAD ANY ACFT IN OUR POSITION-NEGATIVE. THE ACFT CONTINUED LEFT TURN TO PARALLEL OUR COURSE; WE TURNED SLIGHTLY TO LEFT AND CLBED ABOUT 1000' TO AVOID INCIDENT. THE OTHER ACFT FLEW FORMATION ON US FOR ABOUT 5-8 MI (OF RIGHT WING-100' STEP DOWN AND AFT) THEN SLOWED TO TRAIL US; ATC FINALLY ACQUIRED HIS RETURN (WE WERE MERGE PLOT) AS HE SLOWED FROM OUR 250 KT. NO FURTHER INCIDENT. LANDED AT IAD. PHONED IAD ATC. THEY WERE WORKING ON FINDING OUT WHO THE OTHER ACFT WAS. NOTE: ALL EXTERIOR LIGHTS WERE ON; LANDING LIGHTS; WING LIGHT TAIL 'LOGO' LIGHTS; ETC ANTI COLLISION. CALLBACK CONVERSATION REVEALED THE FOLLOWING INFO: THE CREW OF THE ACR LGT WERE NOT ABLE TO TELL THE TYPE OF OTHER ACFT; BUT FELT VERY STRONGLY THAT IT WAS A MIL HIGH-PERFORMANCE FGT. IT SEEMED TO BE TOYING WITH THIS ACR JET. WITH A SPEED OF 250 KTS; THE ACR CREW WATCHED THIS ACFT COME OVER THE TOP OF THEIR ACFT; MAKE A STEEP LEFT; DSNDING TURN AND COME UP ALONG SIDE THEIR ACFT AND THEN MOVE AHEAD AND DROP BACK BEHIND THEIR FLT. RPTR SAID THAT THEY NEVER FELT THERE WOULD BE A COLLISION; BUT THE ACTIONS OF THE OTHER ACFT CAUSED THEM APPREHENSION AT FIRST. DURING THE PHONE CALL TO ATC; IT WAS SPECULATED BY THE ATC THAT THE ACFT WAS A GENERAL AVIATION ACFT FROM MANASSAS ARPT; NEARBY BUT THE ACR FLT CREW REJECT THIS THEORY BASED ON THE SPEED OF THE OTHER ACFT. THE OTHER ACFT REMAINS A MYSTERY AIRPLANE.",,,,"ACR LGT HAD NEAR COLLISION WITH UNIDENTIFIED HIGH PERFORMANCE ACFT.",
80892,198801,1801-2400,MSP,MN,,,0,,,VMC,.75,,Night,,3000,Tower MSP,Air Carrier,Light Transport; Low Wing; 2 Turboprop Eng,,2,,IFR,Passenger,,Descent; Descent; Initial Approach; Landing; Landing,,Class D MSP; Class E MSP,,,,,,,,,,,,,,,,,,,,,,,,,,,,,,,,,,,,,,,,,,,,,,,,,,,,,,,,,,,,,,,,,Air Carrier,First Officer; Pilot Flying,Flight Crew Commercial; Flight Crew Instrument,Flight Crew Last 90 Days 240; Flight Crew Total 1750,,,,,80892,,,,Captain,Flight Crew Air Transport Pilot (ATP),,,,,,,Inflight Event / Encounter Weather / Turbulence; Other No Specific Anomaly Occurred,,,Person Flight Crew,,,,Weather,"WE LEFT HIB FOR A 55 MIN SCHEDULED 135 FLT AFTER APPROX 1 HR GATE HOLD ON GND AT HIB DUE TO WX BELOW MINIMUMS/RWY PLOWING AND SANDING AT MIP INTL. GOT OUR RELEASE AT APPROX XQ45 FROM LCL FSS AT HIB. QUICK CHK OF WX WITH RVR AND VIS RPTED GOOD ENOUGH FOR US TO LEGALLY DEPART. WINDS 020 DEGS AT 11 KTS. ALLOWING US OPTION OF RWY (CURRENTLY IN USE) WITH MINIMUMS RVR 4000; 3/4 MI; DH OF 1080' (250 AGL) OR RWY 29L (IF IT WAS PLOWED AND READY; BUT CAPT WOULD NOT QUERY ATC ABOUT 29L [LOWER MINIMUMS AND I LET HIM KNOW THAT WAS THE RWY I WANTED IF AT ALL POSSIBLE WHILE WE WERE ENRTE). I WAS THE F/O AND IT WAS MY LEG TO FLY. WE WERE SLOWED TO 160 KTS AND GIVEN A 360 DEG TURN AT ABOUT 48 MI OUT. THEN GIVEN DIR MSP TO CROSS 30 N AT 8000'. THEN; GIVEN DIR FCM. SOON WE WERE PUT ON VECTORS FOR RWY 4. TURNED TO INTERCEPT AT 35 MI FINAL. ABOUT 5 MI OUTSIDE THE OM WE WERE TOLD TO CONTACT TWR. CAPT DID NOT CONTACT TWR UNTIL JUST INSIDE THE FAF IN CASE RVR HAD DROPPED BELOW 4000'. TWR INFORMED US THAT RVR 3000' ONCE WE CONTACTED THEM. WE CONTINUED THE APCH AND LANDED. TWR QUERIED US AS TO WHAT VIS WE HAD AND CAPT INFORMED THEM WE HAD 3/4 MI. I QUESTIONED HIM WHEN WE CONTACTED TWR IF WE COULD LEGALLY LAND IF RVR DID NOT COME UP TO 4000'. HE SAID; 'YES WE CAN IF WE HAVE THE LEGAL FLT VIS AT DH. FAR 135.225 IS VERY OBSCURE AS TO HOW CTLING RVR REALLY IS IN THIS SITUATION. I DON'T KNOW HOW THE FED'S LOOK UPON THIS; BUT PLAN TO GET SOME ANSWERS SO THAT THERE IS NO QUESTION THE NEXT TIME. CBC CONVERSATION REVEALED THE FOLLOWING INFO: RPTR HAD NOT MADE AN INQUIRY AS FSDO CONCERNING THIS QUESTION. HE HAD ATTENDED AN INDUSTRY SAFETY SEMINAR AND HAD BEEN TOLD THERE THAT WHAT THEY DID WAS ILLEGAL. RPTR WAS ADVISED DURING CBC THAT THEY COULD CONTINUE ANY APCH THAT WAS COMMENCED WHEN THE WX MET THEIR MINIMUM REQUIREMENTS; AND THAT THE LNDG COULD BE COMPLETED IF THEY COULD SEE THE NECESSARY VISUAL CUES FROM DH IN TO THE RWY.",,,,"ACR LTT CONTINUED APCH AND LANDED AFTER RVR DROPPED BELOW LNDG MINIMA WHEN THEY WERE ON APCH INSIDE FAF.",
